{
  "$schema": "https://json-schema.org/draft/2020-12/schema",
  "$id": "https://fleck.local/schemas/local-dictation-run-v1.schema.json",
  "title": "Fleck local dictation candidate run v1",
  "type": "object",
  "additionalProperties": false,
  "required": ["schemaVersion", "runID", "corpusID", "corpusRevision", "candidate", "environment", "standardBaseline", "unloadEvidence", "results", "offlineEvidence", "failureCancellationEvidence", "syntheticSample", "releaseEvidence"],
  "properties": {
    "schemaVersion": {"const": 1},
    "runID": {"type": "string", "minLength": 1},
    "corpusID": {"type": "string", "minLength": 1},
    "corpusRevision": {"type": "string", "minLength": 1},
    "candidate": {"$ref": "#/$defs/CandidateIdentity"},
    "environment": {"$ref": "#/$defs/RunEnvironment"},
    "standardBaseline": {"$ref": "#/$defs/StandardBaselineEvidence"},
    "unloadEvidence": {"$ref": "#/$defs/UnloadEvidence"},
    "results": {"type": "array", "minItems": 1, "items": {"$ref": "#/$defs/UtteranceResult"}},
    "offlineEvidence": {"$ref": "#/$defs/OfflineEvidence"},
    "failureCancellationEvidence": {"$ref": "#/$defs/FailureCancellationEvidence"},
    "syntheticSample": {"type": "boolean"},
    "releaseEvidence": {"type": "boolean"}
  },
  "$defs": {
    "EvaluationLanguageMode": {"type": "string", "enum": ["english", "mandarin", "mixed"]},
    "TranscriptArtifactKind": {"type": "string", "enum": ["asrRaw", "dictionaryBaseline", "cleanedResult"]},
    "CaptureTemperature": {"type": "string", "enum": ["cold", "warm"]},
    "ThermalState": {"type": "string", "enum": ["nominal", "fair", "serious", "critical"]},
    "ManualAdjudicationStatus": {"type": "string", "enum": ["notRequired", "pending", "passed", "failed"]},
    "EvaluationMetricKind": {"type": "string", "enum": ["englishWordErrorRate", "mandarinCharacterErrorRate", "protectedTermAccuracy"]},
    "EvaluationTextSlice": {
      "type": "object", "additionalProperties": false,
      "required": ["language", "text"],
      "properties": {
        "language": {"$ref": "#/$defs/EvaluationLanguageMode"},
        "text": {"type": "string", "minLength": 1}
      }
    },
    "CandidateIdentity": {
      "type": "object", "additionalProperties": false,
      "required": ["candidateID", "displayName", "modelID", "modelRevision", "runtimeName", "runtimeRevision", "licenseReview"],
      "properties": {
        "candidateID": {"type": "string", "minLength": 1},
        "displayName": {"type": "string", "minLength": 1},
        "modelID": {"type": "string", "minLength": 1},
        "modelRevision": {"type": "string", "minLength": 1},
        "runtimeName": {"type": "string", "minLength": 1},
        "runtimeRevision": {"type": "string", "minLength": 1},
        "licenseReview": {"type": "string", "minLength": 1}
      }
    },
    "RunEnvironment": {
      "type": "object", "additionalProperties": false,
      "required": ["osVersion", "hardwareModel", "architecture", "appBuild", "swiftVersion", "recordedAt"],
      "properties": {
        "osVersion": {"type": "string", "minLength": 1},
        "hardwareModel": {"type": "string", "minLength": 1},
        "architecture": {"type": "string", "minLength": 1},
        "appBuild": {"type": "string", "minLength": 1},
        "swiftVersion": {"type": "string", "minLength": 1},
        "recordedAt": {"type": "string", "minLength": 1}
      }
    },
    "StandardBaselineIdentity": {
      "type": "object", "additionalProperties": false,
      "required": ["baselineID", "baselineRevision", "engine", "modelRevision", "corpusID", "corpusRevision", "osVersion", "hardwareModel", "architecture", "appBuild", "coldObservationCount", "warmObservationCount", "recordedAt"],
      "properties": {
        "baselineID": {"type": "string", "minLength": 1},
        "baselineRevision": {"type": "string", "minLength": 1},
        "engine": {"type": "string", "minLength": 1},
        "modelRevision": {"type": "string", "minLength": 1},
        "corpusID": {"type": "string", "minLength": 1},
        "corpusRevision": {"type": "string", "minLength": 1},
        "osVersion": {"type": "string", "minLength": 1},
        "hardwareModel": {"type": "string", "minLength": 1},
        "architecture": {"type": "string", "minLength": 1},
        "appBuild": {"type": "string", "minLength": 1},
        "coldObservationCount": {"type": "integer", "minimum": 1},
        "warmObservationCount": {"type": "integer", "minimum": 1},
        "recordedAt": {"type": "string", "minLength": 1}
      }
    },
    "StandardBaselineMetric": {
      "type": "object", "additionalProperties": false,
      "required": ["scope", "metric", "value"],
      "properties": {
        "scope": {"$ref": "#/$defs/EvaluationLanguageMode"},
        "metric": {"$ref": "#/$defs/EvaluationMetricKind"},
        "value": {"type": "number", "minimum": 0}
      }
    },
    "StandardBaselineEvidence": {
      "type": "object", "additionalProperties": false,
      "required": ["identity", "metrics"],
      "properties": {
        "identity": {"$ref": "#/$defs/StandardBaselineIdentity"},
        "metrics": {"type": "array", "minItems": 1, "items": {"$ref": "#/$defs/StandardBaselineMetric"}}
      }
    },
    "UnloadEvidence": {
      "type": "object", "additionalProperties": false,
      "required": ["unloadAttempted", "unloadSucceeded", "memoryAfterUnloadBytes", "observedAt"],
      "properties": {
        "unloadAttempted": {"type": "boolean"},
        "unloadSucceeded": {"type": "boolean"},
        "memoryAfterUnloadBytes": {"type": "integer", "minimum": 0},
        "observedAt": {"type": "string", "minLength": 1}
      }
    },
    "LatencyMeasurement": {
      "type": "object", "additionalProperties": false,
      "required": ["coldLoadMilliseconds", "asrMilliseconds", "cleanupMilliseconds", "endToEndMilliseconds"],
      "properties": {
        "coldLoadMilliseconds": {"type": ["number", "null"], "minimum": 0},
        "asrMilliseconds": {"type": "number", "minimum": 0},
        "cleanupMilliseconds": {"type": "number", "minimum": 0},
        "endToEndMilliseconds": {"type": "number", "minimum": 0}
      }
    },
    "ResourceMeasurement": {
      "type": "object", "additionalProperties": false,
      "required": ["peakMemoryBytes", "idleMemoryBytes", "thermalState", "energyImpact", "modelDownloadBytes", "modelInstalledBytes"],
      "properties": {
        "peakMemoryBytes": {"type": "integer", "minimum": 0},
        "idleMemoryBytes": {"type": "integer", "minimum": 0},
        "thermalState": {"$ref": "#/$defs/ThermalState"},
        "energyImpact": {"type": "number", "minimum": 0},
        "modelDownloadBytes": {"type": "integer", "minimum": 0},
        "modelInstalledBytes": {"type": "integer", "minimum": 0}
      }
    },
    "OfflineEvidence": {
      "type": "object", "additionalProperties": false,
      "required": ["networkDisabled", "networkRequestsObserved", "contentTelemetryObserved", "isolationMethod", "startedAt", "endedAt", "evidenceNote"],
      "properties": {
        "networkDisabled": {"type": "boolean"},
        "networkRequestsObserved": {"type": "integer", "minimum": 0},
        "contentTelemetryObserved": {"type": "boolean"},
        "isolationMethod": {"type": "string", "minLength": 1},
        "startedAt": {"type": "string", "minLength": 1},
        "endedAt": {"type": "string", "minLength": 1},
        "evidenceNote": {"type": "string", "minLength": 1}
      }
    },
    "FailureCancellationEvidence": {
      "type": "object", "additionalProperties": false,
      "required": ["schemaVersion", "failureExercised", "failureFallbackVerified", "failureEvidenceID", "failureObservedAt", "cancellationExercised", "cancellationOutcomeVerified", "cancellationEvidenceID", "cancellationObservedAt", "evidenceNote"],
      "properties": {
        "schemaVersion": {"const": 1},
        "failureExercised": {"type": "boolean"},
        "failureFallbackVerified": {"type": "boolean"},
        "failureEvidenceID": {"type": "string", "minLength": 1},
        "failureObservedAt": {"type": "string", "minLength": 1},
        "cancellationExercised": {"type": "boolean"},
        "cancellationOutcomeVerified": {"type": "boolean"},
        "cancellationEvidenceID": {"type": "string", "minLength": 1},
        "cancellationObservedAt": {"type": "string", "minLength": 1},
        "evidenceNote": {"type": "string", "minLength": 1}
      }
    },
    "ManualAdjudication": {
      "type": "object", "additionalProperties": false,
      "required": ["status", "reviewer", "notes"],
      "properties": {
        "status": {"$ref": "#/$defs/ManualAdjudicationStatus"},
        "reviewer": {"type": ["string", "null"]},
        "notes": {"type": ["string", "null"]}
      }
    },
    "UtteranceResult": {
      "type": "object", "additionalProperties": false,
      "required": ["observationID", "caseID", "language", "artifactOrder", "asrRaw", "dictionaryBaseline", "cleanedResult", "captureTemperature", "latency", "resources", "metricHypothesisSlices", "manualAdjudication"],
      "properties": {
        "observationID": {"type": "string", "minLength": 1},
        "caseID": {"type": "string", "minLength": 1},
        "language": {"$ref": "#/$defs/EvaluationLanguageMode"},
        "artifactOrder": {"type": "array", "minItems": 1, "items": {"$ref": "#/$defs/TranscriptArtifactKind"}},
        "asrRaw": {"type": "string", "minLength": 1},
        "dictionaryBaseline": {"anyOf": [{"type": "string", "minLength": 1}, {"type": "null"}]},
        "cleanedResult": {"anyOf": [{"type": "string", "minLength": 1}, {"type": "null"}]},
        "captureTemperature": {"$ref": "#/$defs/CaptureTemperature"},
        "latency": {"$ref": "#/$defs/LatencyMeasurement"},
        "resources": {"$ref": "#/$defs/ResourceMeasurement"},
        "metricHypothesisSlices": {"type": "array", "minItems": 1, "items": {"$ref": "#/$defs/EvaluationTextSlice"}},
        "manualAdjudication": {"anyOf": [{"$ref": "#/$defs/ManualAdjudication"}, {"type": "null"}]}
      }
    }
  }
}
